{"assessment_sha256":"6c5ec3168577d675934299943d3a91444f00f9ad6f5c4808596ac85e2ae6a532","compatibility":"ACCEPT","complete":true,"fields":4,"kind":"representation-assessment","not_assessed":["check-constraints","default-expression-semantics","generated-expression-semantics","triggers","indexes-except-primary-key","extension-behavior"],"reason_counts":{"character_length_changed":0,"collation_changed":0,"collation_unknown":0,"collation_version_mismatch":0,"datetime_precision_changed":0,"declaration_mismatch":0,"field_membership_changed":0,"key_changed":0,"materialization_changed":0,"metadata_unavailable":0,"nullability_changed":0,"nullability_unknown":0,"numeric_changed":0,"table_membership_changed":0,"type_changed":0,"unsupported_representation":0,"upstream_materialization_required":0},"representation_summary_version":1,"scope":"native-column-representation-v1","tables":2}
